<?xml version="1.0" encoding="UTF-8"?>
<Protocols xmlns="http://www.StormForge.com/XMLProtocol" xmlns:xsi="http://www.w3.org/2001/XMLSchema-instance" xsi:schemaLocation="http://www.StormForge.com/XMLProtocol ProtocolDef.xsd">
	<ProtocolGroup Name="Login" GenParameterContext="true" IsMobile="true" GenCSharp="true" Desc="Game">
	
    <!-- ===================================================  Login ========================================================= -->
    <Command Name="Login" Reliable="true" Crypto="No" Trace="Debug1" Desc="Login request">
      <Cmd>
        <Params Type="GameID" Name="GameID" Desc="Game ID, Conspiracy will be accepted"/>
        <Params Type="String" Name="ID" Desc="UserID"/>
        <Params Type="String" Name="Password" Desc="User Password"/>
      </Cmd>
      <Res>
        <Params Type="NetAddress" Name="GameServerAddr" Desc="Game server address to connect"/>
        <Params Type="NetAddress" Name="GameServerAddrIPV4" Desc="Game server address to connect"/>
        <Params Type="AccountID" Name="AccID" Desc="AccountID for the player"/>
        <Params Type="AuthTicket" Name="Ticket" Desc="Login session Ticket"/>
    		<Params Type="uint64" Name="LoginEntityUID" Desc="Login entity ID. This need to be used when you connect to the game server"/>
      </Res>
    </Command>
    <Command Name="LoginByFacebook" Reliable="true" Crypto="No" Trace="Debug1" Desc="Login request with Facebook UID">
      <Cmd>
        <Params Type="GameID" Name="GameID" Desc="Game ID, Conspiracy will be accepted"/>
        <Params Type="uint64" Name="UID" Desc="Facebook UID. You can get when you login to facebook"/>
        <Params Type="String" Name="FaceBookName" Desc="Face book name"/>
        <Params Type="String" Name="EMail" Desc="email address of the player"/>
        <Params Type="String" Name="FacebookToken" Desc="Factbook token, reserved"/>
      </Cmd>
      <Res>
        <Params Type="NetAddress" Name="GameServerAddr" Desc="Game server address to connect"/>
        <Params Type="NetAddress" Name="GameServerAddrIPV4" Desc="Game server address to connect"/>
        <Params Type="AccountID" Name="AccID" Desc="AccountID for the player"/>
        <Params Type="AuthTicket" Name="Ticket" Desc="Login session Ticket"/>
        <Params Type="uint64" Name="LoginEntityUID" Desc="Login entity ID. This need to be used when you connect to the game server"/>
      </Res>
    </Command>

    <Command Name="CreateRandomUser" Reliable="true" Crypto="No" Trace="Debug1" Desc="Login request">
      <Cmd>
        <Params Type="GameID" Name="GameID" Desc="Game ID, Conspiracy will be accepted"/>
        <Params Type="String" Name="CellPhone" Desc="CellPhone"/>
      </Cmd>
      <Res>
        <Params Type="NetAddress" Name="GameServerAddr" Desc="Game server address to connect"/>
        <Params Type="NetAddress" Name="GameServerAddrIPV4" Desc="Game server address to connect"/>
        <Params Type="AccountID" Name="AccID" Desc="AccountID for the player"/>
        <Params Type="AuthTicket" Name="Ticket" Desc="Login session Ticket"/>
        <Params Type="uint64" Name="LoginEntityUID" Desc="Login entity ID. This need to be used when you connect to the game server"/>
      </Res>
    </Command>

	
	
    <Command Name="UpdateMyScore" Reliable="true" Crypto="No" Trace="Debug1" Desc="Update my score and Get Ranking list">
      <Cmd>
        <Params Type="uint64" Name="RankingScore"/>
        <Params Type="RankingType" Name="RankingType"/>
        <Params Type="uint16" Name="Count" Desc="Number of ranking list to query after update"/>
      </Cmd>
      <Res>
        <Params Type="TotalRankingPlayerInformation" Name="Ranking" IsArray="true"/>
      </Res>
    </Command>

    <Command Name="GetRankingList" Reliable="true" Crypto="No" Trace="Debug1" Desc="Get Ranking lise">
      <Cmd>
        <Params Type="RankingType" Name="RankingType"/>
        <Params Type="uint8" Name="BaseRanking" Desc="Base ranking to query, 0 based ranking order"/>
        <Params Type="uint8" Name="Count" Desc="Number of playerinformation to query"/>
      </Cmd>
      <Res>
        <Params Type="TotalRankingPlayerInformation" Name="Ranking" IsArray="true"/>
      </Res>
    </Command>

    <Command Name="DataTest" Reliable="true" Crypto="No" Trace="Debug1" Desc="For network test">
      <Cmd>
        <Params Type="uint8" Name="TestData" IsArray="true"/>
      </Cmd>
      <Res>
        <Params Type="uint8" Name="TestData" IsArray="true"/>
      </Res>
    </Command>
	
	
	<C2SEvent Name="Heartbeat" Reliable="true" Crypto="No" Trace="Debug1" Desc="Heartbeat">
    </C2SEvent>

    <Command Name="DebugPrintALLRanking" Reliable="true" Crypto="No" Trace="Debug1" Desc="Write All!! User Score and Ranking list">
      <Cmd>
        <Params Type="String" Name="FileName"/>
      </Cmd>
      <Res>
      </Res>
    </Command>
    
  </ProtocolGroup>
</Protocols>
