<?xml version="1.0" encoding="UTF-8"?>
<Protocols xmlns="http://www.StormForge.com/XMLProtocol" xmlns:xsi="http://www.w3.org/2001/XMLSchema-instance" xsi:schemaLocation="http://www.StormForge.com/XMLProtocol ../../../StormForge/Engine/Data/Protocol/ProtocolDef.xsd">
  <ProtocolGroup Name="Generic" Desc="Generic Protocol">
    <!-- ============================  Server Generic  ============================================ -->

      <Command Name="GenericFailure" Reliable="true" Crypto="No" Trace="Debug1" Desc="Generic failure message">
          <Cmd>
          </Cmd>
          <Res>
          </Res>
      </Command>

      <Command Name="GenericTransaction" Reliable="true" Crypto="No" Trace="Debug1" Desc="Generic transaction result">
          <Cmd>
          </Cmd>
          <Res>
              <Params TypeName="TransactionID" Name="FinishedTransaction" Desc="TransactionId"/>
			  <Params TypeName="String" Name="Signature" Desc="Transaction signature"/>
          </Res>
      </Command>

  </ProtocolGroup>
</Protocols>
